Sno,keyword
1,hdfc credit card apply offer
2,hdfc credit card apply link
3,hdfc credit card
4,hdfc bank loan on credit card
5,hdfc bank loan on credit card apply
6,hdfc bank credit card loan
7,hdfc credit card loan apply offer
8,hdfc credit card loan
9,hdfc credit card loan apply online
10,Apply HDFC Credit Card loan
11,hdfc bank credit card loan apply
12,credit card loan apply hdfc
13,hdfc credit card loan for everyone
14,hdfc credit card loan apply
15,Loan on hdfc card
16,Apply loan on HDFC credit card
17,HDFC Insta Jumbo Loan
18,Loan on HDFC Card Today
19,instant loan on hdfc credit card
20,Apply Jumbo Loan Instantly
21,HDFC Fast Approval Loan
22,Quick HDFC Loan Apply
23,credit card apply hdfc
24,hdfc credit card for everyone
25,hdfc credit card apply
26,hdfc popular credit cards
27,Best HDFC Credit card
28,hdfc credit card apply now
29,hdfc credit card apply online
30,Apply HDFC Credit Card
31,apply hdfc credit card free
32,apply hdfc bank credit card
33,apply hdfc credit card free link
34,hdfc card apply today link
35,hdfc card apply today
36,hdfc card apply
37,link for hdfc credit card apply
38,hdfc bank loan apply
39,hdfc bank credit card offers
40,Apply for hdfc Credit Card Online
41,hdfc bank credit card loan apply online
42,hdfc credit card apply link online
43,hdfc bank loan on credit card apply
44,hdfc shopping credit card
45,hdfc personal loan
46,hdfc lifetime free credit cards
47,apply hdfc card online from link
48,Hdfc credit card apply karo
49,Hdfc credit card apply link offer
50,apply hdfc card offer
51,hdfc shopping credit card
52,apply hdfc card online
53,apply hdfc card today
54,Submit Your Application Now - HDFC Credit Card Apply
55,apply hdfc free credit card
56,hdfc bank credit card apply
57,hdfc bank credit card for beginners
58,hdfc bank credit apply
59,hdfc bank instant loan apply
60,HDFC Fast Approval Loan
61,hdfc bank jumbo loan
62,hdfc bank jumbo loan credit card
63,hdfc bank credit card jumbo loan
64,hdfc bank credit card jumbo loan
65,hdfc jumbo loan apply
66,hdfc credit card jumbo loan
67,apply hdfc bank credit card loan
68,apply hdfc bank credit card jumbo offer
69,apply hdfc jumbo loan
70,apply hdfc bank jumbo offer
71,hdfc bank card apply
72,hdfc bank card apply online
73,get hdfc bank credit card
74,get card hdfc bank
75,card apply hdfc bank
76,online card apply hdfc bank
77,online atm card apply hdfc bank
78,Hdfc card apply eligibility
79,Hdfc card apply eligibility online
80,hdfc bank loan apply online
81,hdfc card online apply
82,hdfc bank online card apply
83,loan apply hdfc
84,Personal loan apply hdfc
85,HDFC Personal Loan apply online
86,hdfc loan apply now
87,get hdfc card
88,Hdfc bank loan apply online eligibility
89,HDFC-Bank Xpress Loan
90,HDFC xpress personal loan
91,HDFC Bank Credit Card
92,HDFC XPRESS Loan offer
93,apply hdfc loan
94,HDFC Jumbo Loan Apply
95,hdfc jumbo loan offer check
96,loan available hdfc bank
97,hdfc credit apply
98,hdfc credit apply now
99,hdfc bank card
100,choose card hdfc bank
101,apply card hdfc bank
102,get emi card hdfc bank
103,Hdfc emi apply online credit card
104,HDFC Loan apply online
105,HDFC jumbo loan
106,hdfc jumbo personal loan
107,loan by hdfc bank
108,hdfc credit card loan everyone
109,Hdfc credit card eligibility
110,Hdfc credit card eligibility calculator
111,Hdfc credit card on loan
112,HDFC credit card Insta Loan
113,online loan hdfc bank
114,hdfc apply for credit card
115,xpress personal loans hdfc
116,HDFC loan against credit card
117,HDFC low-interest credit card
118,HDFC instant credit card approval
119,insta jumbo loan hdfc
120,hdfc loan
121,hdfc personal loan apply
122,hdfc online loan
123,hdfc credit cards
